{
  "schema": "agent-runtime-session-baseline/v1",
  "captured_at": "2026-06-18T00:11:48.514345+00:00",
  "cwd": "C:\\Users\\ycpig\\agent_runtime",
  "head": "b772c18",
  "branch": "claude/decision-first-console-ia",
  "status_fingerprint": "e3b0c44298fc1c149afbf4c8996fb92427ae41e4649b934ca495991b7852b855",
  "stash_count": 0,
  "worktrees": [
    {
      "path": "C:/Users/ycpig/agent_runtime",
      "HEAD": "b772c188f128722aed15b8011bd9fb7c1dd7ba5d",
      "branch": "claude/decision-first-console-ia"
    },
    {
      "path": "C:/Users/ycpig/agent_runtime/.worktrees/llm-wiki",
      "HEAD": "5846e40c70bdb49423d59ed0af208e9639567c47",
      "branch": "claude/llm-wiki"
    }
  ],
  "active_codex_branches": [
    "claude/deadlock-guardrails",
    "claude/decision-first-console-ia",
    "+ claude/llm-wiki",
    "claude/product-maturity-eval-merge",
    "claude/wave89-closeout",
    "codex/task-ar-552"
  ]
}
