{
  "schema": "agent-runtime-session-baseline/v1",
  "captured_at": "2026-06-20T01:40:16.810167+00:00",
  "cwd": "C:\\Users\\ycpig\\agent_runtime",
  "head": "3a2eb4c",
  "branch": "claude/impl-task-ar-592-redo",
  "status_fingerprint": "2fe81639f67f098395e72b3d0f1833c50aea12c89e4d6dab94df205246db26d1",
  "stash_count": 5,
  "worktrees": [
    {
      "path": "C:/Users/ycpig/agent_runtime",
      "HEAD": "3a2eb4cb190d638775498a2ef8503e7d19666d35",
      "branch": "claude/impl-task-ar-592-redo"
    },
    {
      "path": "C:/Users/ycpig/agent_runtime/.worktrees/TASK-AR-588",
      "HEAD": "3a2eb4cb190d638775498a2ef8503e7d19666d35",
      "branch": "codex/task-ar-588-graph-upgrade"
    }
  ],
  "active_codex_branches": [
    "claude/adopt-vendored",
    "claude/deadlock-guardrails",
    "claude/decision-first-console-ia",
    "claude/fix-avatar-xss",
    "claude/impl-task-ar-583",
    "claude/impl-task-ar-584",
    "claude/impl-task-ar-585",
    "claude/impl-task-ar-586",
    "claude/impl-task-ar-587",
    "claude/impl-task-ar-588",
    "claude/impl-task-ar-589",
    "claude/impl-task-ar-590",
    "claude/impl-task-ar-591",
    "claude/impl-task-ar-592",
    "claude/impl-task-ar-592-redo",
    "claude/product-maturity-eval-merge",
    "claude/release-auto-reg",
    "claude/visual-asset-adoption",
    "claude/vsi-register",
    "claude/wave89-closeout",
    "codex/task-ar-552",
    "+ codex/task-ar-588-graph-upgrade",
    "codex/task-ar-592-a11y-responsive"
  ]
}
