{
  "schema": "agent-runtime-session-baseline/v1",
  "captured_at": "2026-06-18T17:45:15.608838+00:00",
  "cwd": "C:\\Users\\ycpig\\agent_runtime",
  "head": "6661ab1",
  "branch": "claude/decision-first-console-ia",
  "status_fingerprint": "e3b0c44298fc1c149afbf4c8996fb92427ae41e4649b934ca495991b7852b855",
  "stash_count": 0,
  "worktrees": [
    {
      "path": "C:/Users/ycpig/agent_runtime",
      "HEAD": "6661ab1e631a627a0ad89b271c9d4d5ab6176361",
      "branch": "claude/decision-first-console-ia"
    },
    {
      "path": "C:/Users/ycpig/agent_runtime/.worktrees/TASK-AR-599",
      "HEAD": "d5c927e69ba02b747ef444439e4949bc293c9f57",
      "branch": "codex/task-ar-599-ui-ux-propose"
    }
  ],
  "active_codex_branches": [
    "claude/deadlock-guardrails",
    "claude/decision-first-console-ia",
    "claude/product-maturity-eval-merge",
    "claude/release-auto-reg",
    "claude/wave89-closeout",
    "codex/task-ar-552",
    "+ codex/task-ar-599-ui-ux-propose"
  ]
}
